<?xml version="1.0" encoding="UTF-8"?>
<DeviceSubTypeInfo xmlns:xsi="http://www.w3.org/2001/XMLSchema-instance" xsi:noNamespaceSchemaLocation="DeviceSubTypeInfo.xsd">
	<DeviceSubTypes>
		<DeviceSubType>
			<DeviceType>信号机</DeviceType>
			<SubType>信号机</SubType>
		</DeviceSubType>
		<DeviceSubType>
			<DeviceType>物理区段</DeviceType>
			<SubType>物理区段</SubType>
		</DeviceSubType>
		<DeviceSubType>
			<DeviceType>站台</DeviceType>
			<SubType>站台</SubType>
		</DeviceSubType>
		<DeviceSubType>
			<DeviceType>联锁区</DeviceType>
			<SubType>联锁区</SubType>
		</DeviceSubType>
		<DeviceSubType>
			<DeviceType>股道</DeviceType>
			<SubType>股道</SubType>
		</DeviceSubType>
		<DeviceSubType>
			<DeviceType>区间逻辑区段</DeviceType>
			<SubType>区间逻辑区段</SubType>
		</DeviceSubType>
		<DeviceSubType>
			<DeviceType>虚拟</DeviceType>
			<SubType>虚拟</SubType>
		</DeviceSubType>
		<DeviceSubType>
			<DeviceType>表示灯</DeviceType>
			<SubType>表示灯</SubType>
		</DeviceSubType>
		<DeviceSubType>
			<DeviceType>车次窗</DeviceType>
			<SubType>车次窗</SubType>
		</DeviceSubType>
		<DeviceSubType>
			<DeviceType>车站</DeviceType>
			<SubType>车站</SubType>
		</DeviceSubType>
		<DeviceSubType>
			<DeviceType>道岔</DeviceType>
			<SubType>道岔</SubType>
		</DeviceSubType>
		<DeviceSubType>
			<DeviceType>进路</DeviceType>
			<SubType>进路</SubType>
		</DeviceSubType>
	</DeviceSubTypes>
</DeviceSubTypeInfo>
